[
  {
    "name": "pi",
    "label": "pi",
    "definition": "pi",
    "formula_text": "circle constant",
    "primitives": [
      "pi"
    ],
    "fixed_point": true,
    "sensitivity": {
      "Sc3": null,
      "Sphi0": null,
      "mode": "external"
    },
    "value_pred": 3.141592653589793,
    "value_ref": null,
    "delta_ppm": null,
    "units": "dimensionless",
    "unit_system": "natural_units",
    "status": "input",
    "lineage": "anchor",
    "proof_ref": null,
    "source": null,
    "latex_snippet": "\\paragraph{pi (pi)}\nDefinition: ${pi}$.\\\\\nMeaning: circle constant.\\\\\nValue: ${3.141592653589793}\\,\\mathrm{dimensionless}$.\\\\\nSensitivities: $S_{c_3}=None,\\;S_{\\varphi_0}=None$.\n",
    "reference_info": {
      "type": "analytic",
      "origin": "geometry constant"
    },
    "approximation": null,
    "reference_role": "anchor",
    "source_module_id": null,
    "source_artifact": null,
    "source_json_pointer": null
  },
  {
    "name": "g",
    "label": "g",
    "definition": "g",
    "formula_text": "SU(5) holonomy multiplicity (two-defect)",
    "primitives": [
      "c3",
      "varphi0",
      "pi"
    ],
    "fixed_point": false,
    "sensitivity": {
      "Sc3": null,
      "Sphi0": null,
      "mode": "external"
    },
    "value_pred": 5.0,
    "value_ref": null,
    "delta_ppm": null,
    "units": "dimensionless",
    "unit_system": "natural_units",
    "status": "derived",
    "lineage": "discrete_scan",
    "proof_ref": null,
    "source": "defect_partition_g5_audit",
    "latex_snippet": "\\paragraph{g (g)}\nDefinition: ${g}$.\\\\\nMeaning: SU(5) holonomy multiplicity (two-defect).\\\\\nValue: ${5.0}\\,\\mathrm{dimensionless}$.\\\\\nSensitivities: $S_{c_3}=None,\\;S_{\\varphi_0}=None$.\n",
    "reference_info": {
      "type": "internal_derivation",
      "origin": "defect_partition_g5_audit"
    },
    "approximation": null,
    "reference_role": "internal",
    "source_module_id": "defect_partition_g5_audit",
    "source_artifact": "results.json",
    "source_json_pointer": "/results/delta2/g_value"
  },
  {
    "name": "k",
    "label": "k",
    "definition": "k",
    "formula_text": "backreaction cover degree (min |ppm|)",
    "primitives": [
      "c3",
      "varphi0",
      "pi"
    ],
    "fixed_point": false,
    "sensitivity": {
      "Sc3": null,
      "Sphi0": null,
      "mode": "external"
    },
    "value_pred": 2.0,
    "value_ref": null,
    "delta_ppm": null,
    "units": "dimensionless",
    "unit_system": "natural_units",
    "status": "derived",
    "lineage": "discrete_scan",
    "proof_ref": null,
    "source": "alpha_backreaction_sensitivity_audit",
    "latex_snippet": "\\paragraph{k (k)}\nDefinition: ${k}$.\\\\\nMeaning: backreaction cover degree (min |ppm|).\\\\\nValue: ${2.0}\\,\\mathrm{dimensionless}$.\\\\\nSensitivities: $S_{c_3}=None,\\;S_{\\varphi_0}=None$.\n",
    "reference_info": {
      "type": "internal_derivation",
      "origin": "alpha_backreaction_sensitivity_audit"
    },
    "approximation": null,
    "reference_role": "internal",
    "source_module_id": "alpha_backreaction_sensitivity_audit",
    "source_artifact": "results.json",
    "source_json_pointer": "/results/abs_ppm"
  },
  {
    "name": "gamma0",
    "label": "gamma0",
    "definition": "g/(g+1)",
    "formula_text": "crosslink signature",
    "primitives": [
      "c3",
      "varphi0",
      "pi"
    ],
    "fixed_point": true,
    "sensitivity": {
      "Sc3": 0.0,
      "Sphi0": 0.0,
      "mode": "numeric"
    },
    "value_pred": 0.8333333333333334,
    "value_ref": null,
    "delta_ppm": null,
    "units": "dimensionless",
    "unit_system": "natural_units",
    "status": "derived",
    "lineage": "axiom",
    "proof_ref": null,
    "source": null,
    "latex_snippet": "\\paragraph{gamma0 (gamma0)}\nDefinition: ${g/(g+1)}$.\\\\\nMeaning: crosslink signature.\\\\\nValue: ${0.8333333333333334}\\,\\mathrm{dimensionless}$.\\\\\nSensitivities: $S_{c_3}=0.0,\\;S_{\\varphi_0}=0.0$.\n",
    "reference_info": {
      "type": "internal_derivation",
      "origin": "g5_crosslink_audit"
    },
    "approximation": null,
    "reference_role": "internal",
    "source_module_id": null,
    "source_artifact": null,
    "source_json_pointer": null
  },
  {
    "name": "delta2",
    "label": "delta2",
    "definition": "(g/4)*delta_top^2",
    "formula_text": null,
    "primitives": [
      "c3",
      "varphi0",
      "pi"
    ],
    "fixed_point": false,
    "sensitivity": {
      "Sc3": 0.0,
      "Sphi0": 0.0,
      "mode": "numeric"
    },
    "value_pred": 1.8091459748867854e-08,
    "value_ref": null,
    "delta_ppm": null,
    "units": "dimensionless",
    "unit_system": "natural_units",
    "status": "derived",
    "lineage": "discrete_scan",
    "proof_ref": null,
    "source": null,
    "latex_snippet": "\\paragraph{delta2 (delta2)}\nDefinition: ${(g/4)*delta_top^2}$.\\\\\nValue: ${1.8091459748867854e-08}\\,\\mathrm{dimensionless}$.\\\\\nSensitivities: $S_{c_3}=0.0,\\;S_{\\varphi_0}=0.0$.\n",
    "reference_info": {
      "type": "internal_derivation",
      "origin": "defect_partition_g5_audit"
    },
    "approximation": null,
    "reference_role": "internal",
    "source_module_id": null,
    "source_artifact": null,
    "source_json_pointer": null
  },
  {
    "name": "c3",
    "label": "c3",
    "definition": "1/(8*pi)",
    "formula_text": null,
    "primitives": [
      "pi"
    ],
    "fixed_point": true,
    "sensitivity": {
      "Sc3": 0.9999999999177334,
      "Sphi0": 0.0,
      "mode": "numeric"
    },
    "value_pred": 0.039788735772973836,
    "value_ref": null,
    "delta_ppm": null,
    "units": "dimensionless",
    "unit_system": "natural_units",
    "status": "derived",
    "lineage": "axiom",
    "proof_ref": null,
    "source": null,
    "latex_snippet": "\\paragraph{c3 (c3)}\nDefinition: ${1/(8*pi)}$.\\\\\nValue: ${0.039788735772973836}\\,\\mathrm{dimensionless}$.\\\\\nSensitivities: $S_{c_3}=0.9999999999177334,\\;S_{\\varphi_0}=0.0$.\n",
    "reference_info": null,
    "approximation": null,
    "reference_role": "prediction",
    "source_module_id": null,
    "source_artifact": null,
    "source_json_pointer": null
  },
  {
    "name": "varphi0_tree",
    "label": "varphi0_tree",
    "definition": "1/(6*pi)",
    "formula_text": null,
    "primitives": [
      "pi"
    ],
    "fixed_point": true,
    "sensitivity": {
      "Sc3": 0.0,
      "Sphi0": 1.002267686178726,
      "mode": "numeric"
    },
    "value_pred": 0.05305164769729844,
    "value_ref": null,
    "delta_ppm": null,
    "units": "dimensionless",
    "unit_system": "natural_units",
    "status": "derived",
    "lineage": "axiom",
    "proof_ref": null,
    "source": null,
    "latex_snippet": "\\paragraph{varphi0_tree (varphi0_tree)}\nDefinition: ${1/(6*pi)}$.\\\\\nValue: ${0.05305164769729844}\\,\\mathrm{dimensionless}$.\\\\\nSensitivities: $S_{c_3}=0.0,\\;S_{\\varphi_0}=1.002267686178726$.\n",
    "reference_info": null,
    "approximation": null,
    "reference_role": "prediction",
    "source_module_id": null,
    "source_artifact": null,
    "source_json_pointer": null
  },
  {
    "name": "delta_top",
    "label": "delta_top",
    "definition": "3/(256*pi^4)",
    "formula_text": null,
    "primitives": [
      "pi"
    ],
    "fixed_point": true,
    "sensitivity": {
      "Sc3": 0.0,
      "Sphi0": 0.0,
      "mode": "numeric"
    },
    "value_pred": 0.00012030447954708205,
    "value_ref": null,
    "delta_ppm": null,
    "units": "dimensionless",
    "unit_system": "natural_units",
    "status": "derived",
    "lineage": "axiom",
    "proof_ref": null,
    "source": null,
    "latex_snippet": "\\paragraph{delta_top (delta_top)}\nDefinition: ${3/(256*pi^4)}$.\\\\\nValue: ${0.00012030447954708205}\\,\\mathrm{dimensionless}$.\\\\\nSensitivities: $S_{c_3}=0.0,\\;S_{\\varphi_0}=0.0$.\n",
    "reference_info": null,
    "approximation": null,
    "reference_role": "prediction",
    "source_module_id": null,
    "source_artifact": null,
    "source_json_pointer": null
  },
  {
    "name": "varphi0",
    "label": "varphi0",
    "definition": "varphi0_tree+delta_top",
    "formula_text": null,
    "primitives": [
      "c3",
      "varphi0",
      "pi"
    ],
    "fixed_point": true,
    "sensitivity": {
      "Sc3": 0.0,
      "Sphi0": 1.000000000139778,
      "mode": "numeric"
    },
    "value_pred": 0.053171952176845526,
    "value_ref": null,
    "delta_ppm": null,
    "units": "dimensionless",
    "unit_system": "natural_units",
    "status": "derived",
    "lineage": "axiom",
    "proof_ref": null,
    "source": null,
    "latex_snippet": "\\paragraph{varphi0 (varphi0)}\nDefinition: ${varphi0_tree+delta_top}$.\\\\\nValue: ${0.053171952176845526}\\,\\mathrm{dimensionless}$.\\\\\nSensitivities: $S_{c_3}=0.0,\\;S_{\\varphi_0}=1.000000000139778$.\n",
    "reference_info": null,
    "approximation": null,
    "reference_role": "prediction",
    "source_module_id": null,
    "source_artifact": null,
    "source_json_pointer": null
  },
  {
    "name": "delta_star",
    "label": "delta_star",
    "definition": "3/5+varphi0/6",
    "formula_text": null,
    "primitives": [
      "c3",
      "varphi0",
      "pi"
    ],
    "fixed_point": true,
    "sensitivity": {
      "Sc3": 0.0,
      "Sphi0": 0.014555009419936482,
      "mode": "numeric"
    },
    "value_pred": 0.6088619920294742,
    "value_ref": null,
    "delta_ppm": null,
    "units": "dimensionless",
    "unit_system": "natural_units",
    "status": "derived",
    "lineage": "axiom",
    "proof_ref": null,
    "source": null,
    "latex_snippet": "\\paragraph{delta_star (delta_star)}\nDefinition: ${3/5+varphi0/6}$.\\\\\nValue: ${0.6088619920294742}\\,\\mathrm{dimensionless}$.\\\\\nSensitivities: $S_{c_3}=0.0,\\;S_{\\varphi_0}=0.014555009419936482$.\n",
    "reference_info": null,
    "approximation": null,
    "reference_role": "prediction",
    "source_module_id": null,
    "source_artifact": null,